,event_message,venue_name,venue_address,venue_lat,venue_lon
0,"Holiday Music, Lolita Lynne, & Devan Mulvaney at Hotel Vegas ",Hotel Vegas,1500 E. 6th St.,30.2634308,-97.727264
1,"Me Mer Mo Monday!! with Mossery, Randall Holt, Null Hypothesis, Christopher Petkus + Steve Mankenberg, Grainger Weston, DJ Progscott (KOOP's Tom Laird), DJ Jacob Green, Projections by Vision System at the Volstead Lounge ",The Volstead Lounge,1500 E. 6th St.,30.2634308,-97.727264
2,"3Teeth, HO99O9, Street Sects at Barracuda ",Barracuda ,611 E. 7th St.,30.2670856,-97.7362808
3,"Will Maxwell, Brother Bear, Battle Bend at Cheer Up Charlies ",Cheer Up Charlies,900 Red River,30.2696098,-97.7363583
4,"A Candlelit Evening With John Kadlicek, Josh Pearson at the Mohawk ",The Mohawk,912 Red River,30.2701568,-97.7360368
5,Willy Chapel at the Hole in the Wall ,Hole in the Wall,2538 Guadalupe,30.2900705,-97.7417764
